{
  "confidence": null,
  "effective_at": "2026-08-02T09:09:45.851000Z",
  "evidence": [
    {
      "claim": "Retained MB2 record for Treasure Cruise.",
      "observed_at": "2026-08-02T09:09:45.851000Z",
      "reference": "data/market/acquisitions/scryfall-mb2-30754638264-1/source-mb2.json",
      "source_id": "scryfall-mb2-30754638264-1",
      "source_type": "retained_dataset"
    }
  ],
  "fact_id": "phase132-treasure-cruise-value_driver-demand",
  "kind": "demand",
  "predicate": "value_driver.demand",
  "recorded_at": "2026-08-03T00:00:00Z",
  "schema_version": "card-knowledge-fact-v1",
  "subject": {
    "card_id": "5b6bdf5a-2742-4851-92cd-a857a3852836",
    "game_id": "magic"
  },
  "supersedes": [],
  "value": {
    "data": null,
    "status": "unknown"
  }
}
