{
  "confidence": null,
  "effective_at": "2026-08-02T09:09:45.851000Z",
  "evidence": [
    {
      "claim": "Retained MB2 record for Command Tower.",
      "observed_at": "2026-08-02T09:09:45.851000Z",
      "reference": "data/market/acquisitions/scryfall-mb2-30754638264-1/source-mb2.json",
      "source_id": "scryfall-mb2-30754638264-1",
      "source_type": "retained_dataset"
    }
  ],
  "fact_id": "phase132-command-tower-mechanical-oracle_text",
  "kind": "mechanical_theme",
  "predicate": "mechanical.oracle_text",
  "recorded_at": "2026-08-03T00:00:00Z",
  "schema_version": "card-knowledge-fact-v1",
  "subject": {
    "card_id": "0895c9b7-ae7d-4bb3-af17-3b75deb50a25",
    "game_id": "magic"
  },
  "supersedes": [],
  "value": {
    "data": {
      "oracle_text": "{T}: Add one mana of any color in your commander's color identity."
    },
    "status": "known"
  }
}
