{
  "confidence": null,
  "effective_at": "2026-08-02T09:09:45.851000Z",
  "evidence": [
    {
      "claim": "Retained MB2 record for Goblin King.",
      "observed_at": "2026-08-02T09:09:45.851000Z",
      "reference": "data/market/acquisitions/scryfall-mb2-30754638264-1/source-mb2.json",
      "source_id": "scryfall-mb2-30754638264-1",
      "source_type": "retained_dataset"
    }
  ],
  "fact_id": "phase132-goblin-king-mechanical-oracle_text",
  "kind": "mechanical_theme",
  "predicate": "mechanical.oracle_text",
  "recorded_at": "2026-08-03T00:00:00Z",
  "schema_version": "card-knowledge-fact-v1",
  "subject": {
    "card_id": "d236b3fc-0d3f-4d99-875d-e32a33fe5767",
    "game_id": "magic"
  },
  "supersedes": [],
  "value": {
    "data": {
      "oracle_text": "Other Goblins get +1/+1 and have mountainwalk."
    },
    "status": "known"
  }
}
