{
  "confidence": null,
  "effective_at": "2026-08-02T09:09:45.851000Z",
  "evidence": [
    {
      "claim": "Retained MB2 record for Walking Ballista.",
      "observed_at": "2026-08-02T09:09:45.851000Z",
      "reference": "data/market/acquisitions/scryfall-mb2-30754638264-1/source-mb2.json",
      "source_id": "scryfall-mb2-30754638264-1",
      "source_type": "retained_dataset"
    }
  ],
  "fact_id": "phase132-walking-ballista-mechanical-direct_damage",
  "kind": "removal",
  "predicate": "mechanical.direct_damage",
  "recorded_at": "2026-08-03T00:00:00Z",
  "schema_version": "card-knowledge-fact-v1",
  "subject": {
    "card_id": "4b515bb0-f275-4400-8032-3173b799ab40",
    "game_id": "magic"
  },
  "supersedes": [],
  "value": {
    "data": {
      "claim": "Can remove a +1/+1 counter to deal one damage to any target."
    },
    "status": "known"
  }
}
