{
  "confidence": null,
  "effective_at": "2026-08-02T09:09:45.851000Z",
  "evidence": [
    {
      "claim": "Retained MB2 record for Treasure Cruise.",
      "observed_at": "2026-08-02T09:09:45.851000Z",
      "reference": "data/market/acquisitions/scryfall-mb2-30754638264-1/source-mb2.json",
      "source_id": "scryfall-mb2-30754638264-1",
      "source_type": "retained_dataset"
    }
  ],
  "fact_id": "phase132-treasure-cruise-format-legalities",
  "kind": "legality",
  "predicate": "format.legalities",
  "recorded_at": "2026-08-03T00:00:00Z",
  "schema_version": "card-knowledge-fact-v1",
  "subject": {
    "card_id": "5b6bdf5a-2742-4851-92cd-a857a3852836",
    "game_id": "magic"
  },
  "supersedes": [],
  "value": {
    "data": {
      "alchemy": "not_legal",
      "brawl": "legal",
      "commander": "legal",
      "competitivebrawl": "legal",
      "duel": "banned",
      "future": "not_legal",
      "gladiator": "legal",
      "historic": "legal",
      "legacy": "banned",
      "modern": "banned",
      "oathbreaker": "legal",
      "oldschool": "not_legal",
      "pauper": "banned",
      "paupercommander": "legal",
      "penny": "not_legal",
      "pioneer": "legal",
      "predh": "not_legal",
      "premodern": "not_legal",
      "standard": "not_legal",
      "standardbrawl": "not_legal",
      "timeless": "legal",
      "tlr": "not_legal",
      "vintage": "restricted"
    },
    "status": "known"
  }
}
