{
  "confidence": null,
  "effective_at": "2024-08-02T00:00:00Z",
  "evidence": [
    {
      "claim": "Retained Phase 135 evidence supplies 8 supported non-MB2 Printing records for Goblin Charbelcher.",
      "observed_at": "2026-08-03T05:05:31Z",
      "reference": "data/evidence/phase-135/mtgjson-pilot-30786023976-1/source-pilot-printings.json#card_id=c9b1557b-70b1-44f2-9fc2-7aa0b035b187;normalized_sha256=493df83312c8d9271e84a143ed288767d7fbf53d7b4a23bfc2f72af514bc67e6",
      "source_id": "mtgjson-pilot-30786023976-1",
      "source_type": "retained_acquisition"
    },
    {
      "claim": "Post-promotion canonical snapshot contains 9 bounded Printings for Goblin Charbelcher.",
      "observed_at": "2026-08-05T00:00:00Z",
      "reference": "data/canonical/state.json#sha256:881c4ddf1dd5f3dc8004aef001277407e359b165cba6d9f5e8d442e9eef48077;card=c9b1557b-70b1-44f2-9fc2-7aa0b035b187;printings=9",
      "source_id": "phase-136-canonical-state",
      "source_type": "canonical_snapshot"
    }
  ],
  "fact_id": "phase136-goblin-charbelcher-printing-reprint_history",
  "kind": "reprint_history",
  "predicate": "printing.reprint_history",
  "recorded_at": "2026-08-05T00:00:00Z",
  "schema_version": "card-knowledge-fact-v1",
  "subject": {
    "card_id": "c9b1557b-70b1-44f2-9fc2-7aa0b035b187",
    "game_id": "magic"
  },
  "supersedes": [
    "phase133-goblin-charbelcher-printing-reprint_history"
  ],
  "value": {
    "data": {
      "canonical_printing_ids": [
        "29c6b8dc-bba1-51a3-9ac1-ce9cab786ebb",
        "4aa6dae9-0664-5051-9000-edb6cd5fde0c",
        "750a5a03-d243-5832-a842-69552e3ac589",
        "97f641f1-98f8-5bd3-bb17-4edb78fbc035",
        "a1d3f4a7-f84e-52ba-8db8-9770ba5401af",
        "ae50d6ba-a87e-5f9e-a786-a19e41245daf",
        "c88c0114-34f3-5cc8-9119-41d4dd106a65",
        "d4de9bdb-b816-502a-b052-b27f5adb8bc7",
        "ea8ce597-164a-56f4-984c-3a4775402a6d"
      ],
      "coverage_state": "incomplete",
      "distinct_canonical_set_count": 7,
      "earliest_known_canonical_printing_date": "2003-10-02",
      "elapsed_days_between_known_date_boundaries": 7610,
      "evidence_completeness_state": "bounded_phase_135_retained_projection_plus_existing_mb2",
      "known_finishes": [
        "foil",
        "nonfoil",
        "signed"
      ],
      "known_languages": [
        "English"
      ],
      "known_treatments": [
        "1997",
        "2003",
        "2015",
        "future"
      ],
      "latest_known_canonical_printing_date": "2024-08-02",
      "limitations": [
        "The retained projection is bounded to ten card names and does not prove globally complete printing history.",
        "Printing count is not supply quantity.",
        "Unknown promotional and paper-or-digital values remain unknown."
      ],
      "post_promotion_canonical_snapshot_identity": "sha256:881c4ddf1dd5f3dc8004aef001277407e359b165cba6d9f5e8d442e9eef48077",
      "promotional_dimensions": {
        "known_nonpromotional_mb2_printing_count": 1,
        "known_promotional_printing_count": 0,
        "unknown_promotional_printing_count": 8
      },
      "reprint_count": 8,
      "reprint_count_definition": "max(total distinct canonical printings - 1, 0)",
      "set_codes_and_names": [
        {
          "code": "BRR",
          "name": "The Brothers' War Retro Artifacts"
        },
        {
          "code": "DDT",
          "name": "Duel Decks: Merfolk vs. Goblins"
        },
        {
          "code": "EMA",
          "name": "Eternal Masters"
        },
        {
          "code": "MB2",
          "name": "Mystery Booster 2"
        },
        {
          "code": "MRD",
          "name": "Mirrodin"
        },
        {
          "code": "PLST",
          "name": "The List"
        },
        {
          "code": "WC04",
          "name": "World Championship Decks 2004"
        }
      ],
      "special_printing_dimensions": {
        "digital_printing_count": 0,
        "source_reprint_false_count": 0,
        "source_reprint_true_count": 7,
        "unknown_paper_or_digital_count": 8
      },
      "total_known_canonical_printings": 9
    },
    "status": "known"
  }
}
